{
  "$schema": "http://json-schema.org/draft-07/schema#",
  "$id": "https://portx.io/schema/package.json",
  "title": "PORTX Package Schema",
  "description": "Schema for PORTX package.json files",
  "type": "object",
  "required": ["name", "version", "description", "importType"],
  "properties": {
    "name": {
      "type": "string",
      "pattern": "^[a-z0-9]([a-z0-9-])*[a-z0-9]?$",
      "description": "Package name (lowercase, alphanumeric with hyphens)"
    },
    "version": {
      "type": "string", 
      "pattern": "^\\d+\\.\\d+\\.\\d+$",
      "description": "Semantic version (major.minor.patch)"
    },
    "description": {
      "type": "string",
      "minLength": 10,
      "description": "Brief package description (minimum 10 characters)"
    },
    "importType": {
      "type": "string",
      "enum": ["wrap", "path", "none"],
      "description": "Import strategy: wrap (create wrappers with intelligent PATH detection), path (add package root to PATH), none (documentation only, no imports)"
    },
    "bin": {
      "type": "object",
      "patternProperties": {
        "^[a-z0-9-]+$": {
          "type": "object",
          "required": ["path", "description"],
          "properties": {
            "path": {
              "type": "string",
              "pattern": "^[^/].*\\.(exe|cmd|bat)$",
              "description": "Executable path from package root (e.g., bin/tool.exe or tool.exe)"
            },
            "description": {
              "type": "string",
              "minLength": 10,
              "description": "Tool description (minimum 10 characters)"
            },
            "usage": {
              "type": "string",
              "description": "Usage examples and command patterns"
            },
            "dependencies": {
              "type": "string",
              "enum": ["windows", "linux", "cross-platform", "native"],
              "default": "windows",
              "description": "Platform dependencies"
            }
          },
          "additionalProperties": false
        }
      },
      "additionalProperties": false,
      "description": "Executable tools in this package"
    },
    "tags": {
      "type": "array",
      "items": {
        "type": "string",
        "pattern": "^[a-z0-9-]+$"
      },
      "uniqueItems": true,
      "minItems": 6,
      "description": "Package categorization tags (minimum 6 required)"
    }
  },
  "additionalProperties": false,
  "if": {
    "properties": {
      "importType": {"const": "wrap"}
    }
  },
  "then": {
    "required": ["bin"],
    "properties": {
      "bin": {
        "minProperties": 1
      }
    }
  }
}