{
  "name": "yajsv",
  "version": "1.4.1",
  "description": "JSON schema validator - validate JSON documents against JSON Schema",
  "importType": "wrap",
  "bin": {
    "yajsv": {
      "path": "yajsv.exe",
      "description": "Yet Another JSON Schema Validator - fast and simple JSON Schema validation tool",
      "usage": "yajsv -s schema.json data.json\\nyajsv -s schema.json data1.json data2.json\\necho '{\"name\":\"test\"}' | yajsv -s schema.json",
      "dependencies": "windows"
    }
  },
  "tags": ["json", "schema", "validator", "validation", "jsonschema", "go", "cli", "standards"]
}