{
  "name": "yara",
  "version": "1.0.0",
  "description": "Pattern matching engine for malware identification and classification in security research",
  "importType": "wrap",
  "bin": {
    "yara32": {
      "path": "yara32.exe",
      "description": "Scan files and processes using YARA rules to identify malware and suspicious patterns",
      "usage": "yara32 rules.yar suspicious_file.exe\\nyara32 -r rules.yar /path/to/scan\\nyara32 -p 1234 rules.yar\\nyara32 -s rules.yar file.exe\\nyara32 -g rules.yar file.exe",
      "dependencies": "windows"
    },
    "yarac32": {
      "path": "yarac32.exe",
      "description": "Compile YARA rules into binary format for faster scanning and distribution",
      "usage": "yarac32 rules.yar rules.yarc\\nyarac32 -d symbol=value rules.yar\\nyarac32 -n namespace rules.yar\\nyarac32 -w rules.yar",
      "dependencies": "windows"
    }
  },
  "tags": ["malware", "pattern", "matching", "security", "rules", "scanning", "forensics", "c"]
}
