{
  "name": "chocolatey",
  "version": "2.3.0",
  "description": "Windows package manager for automated software installation and management",
  "importType": "wrap",
  "bin": {
    "choco": {
      "path": "choco.exe",
      "description": "The Package Manager for Windows - automates installation, upgrade, and removal of Windows software packages",
      "usage": "choco install package\\nchoco upgrade all\\nchoco list --local-only\\nchoco uninstall package\\nchoco search keyword",
      "dependencies": "windows"
    }
  },
  "tags": ["package-manager", "windows", "installer", "automation", "software", "management"]
}