{
  "name": "gosec",
  "version": "2.22.8",
  "description": "Go security analyzer - inspects source code for security problems",
  "importType": "wrap",
  "bin": {
    "gosec": {
      "path": "gosec.exe",
      "description": "Go security checker that scans Go AST and SSA for security vulnerabilities - static analysis security testing tool",
      "usage": "gosec ./...\\ngosec -fmt json -out results.json ./...\\ngosec -exclude G104 ./...\\ngosec -include G401,G501 ./...",
      "dependencies": "windows"
    }
  },
  "tags": ["go", "security", "analyzer", "sast", "static-analysis", "vulnerabilities", "ast", "ssa"]
}